<installation version="1.0"
              xmlns:xi="http://www.w3.org/2001/XInclude"
              xmlns:xsi="http://www.w3.org/2001/XMLSchema-instance"
              xmlns="http://izpack.org/xsd/installation"
              xsi:schemaLocation="http://izpack.org/xsd/installation ../../../../../../../../../../izpack-core/src/main/resources/org/izpack/xsd/installation.xsd">
    <info>
        <appname>name</appname>
        <appversion>version</appversion>
    </info>
    <packs>
        <xi:include href="content-fragment.xml" />
        <xi:include href="content-fragment.xml" />
        <xi:include href="content-fragment.xml" />
    </packs>
    <panels>
    </panels>
    <locale>
        <langpack iso3="fr" />
    </locale>
</installation>