<installation version="1.0"
              xmlns:xi="http://www.w3.org/2001/XInclude"
              xmlns:xsi="http://www.w3.org/2001/XMLSchema-instance"
              xmlns="http://izpack.org/xsd/installation"
              xsi:schemaLocation="http://izpack.org/xsd/installation ../../../../../../../../../izpack-core/src/main/resources/xsd/installation.xsd">
    <info>
        <appname>name</appname>
        <appversion>version</appversion>
    </info>
    <packs>
        <pack>
            <description>pack test</description>
        </pack>
        <xi:include href="does-not-exist.xml">
            <xi:fallback>
                <pack>
                    <description>pack test 2</description>
                </pack>
            </xi:fallback>
        </xi:include>
    </packs>
    <panels>
    </panels>
    <locale>
        <langpack iso3="fr" />
    </locale>
</installation>