<installation version="1.0"
              xmlns:xi="http://www.w3.org/2001/XInclude"
              xmlns:xsi="http://www.w3.org/2001/XMLSchema-instance"
              xmlns="http://izpack.org/xsd/installation"
              xsi:schemaLocation="http://izpack.org/xsd/installation ../../../../../../../../../../izpack-core/src/main/resources/org/izpack/lxsd/installation.xsd">
    <info>
        <appname>name</appname>
        <appversion>version</appversion>
    </info>
    <packs>
        <pack>
            <description>
                This is some sample text that should be included
            </description>
        </pack>
    </packs>
    <panels>
    </panels>
    <locale>
        <langpack iso3="fr" />
    </locale>
</installation>